{
  "format": "rl-s6-campaign-result-v2",
  "source_campaign": "artifacts/rl/s6/rl-s6-v1",
  "source_decision": "FAILED_RL_S6",
  "decision": "RL_S6_V2_PASSED",
  "conforming_seed_count": 4,
  "required_conforming_seed_count": 4,
  "no_training": true,
  "seeds": [
    {"seed": 19, "candidate_unit": 110, "checkpoint_sha256": "0000000000000000000000000000000000000000000000000000000000000000", "gate": {"format": "rl-s6-publication-evaluation-v2", "bootstrap": {}, "opponents": {}, "main": {}, "acceptance_criteria": {}, "rejection_criteria": {}, "failed_criteria": [], "decision": "pass", "extension_required": false}, "extension_games": 0},
    {"seed": 20, "candidate_unit": 90, "checkpoint_sha256": "0000000000000000000000000000000000000000000000000000000000000000", "gate": {"format": "rl-s6-publication-evaluation-v2", "bootstrap": {}, "opponents": {}, "main": {}, "acceptance_criteria": {}, "rejection_criteria": {}, "failed_criteria": [], "decision": "pass", "extension_required": false}, "extension_games": 0},
    {"seed": 21, "candidate_unit": 125, "checkpoint_sha256": "0000000000000000000000000000000000000000000000000000000000000000", "gate": {"format": "rl-s6-publication-evaluation-v2", "bootstrap": {}, "opponents": {}, "main": {}, "acceptance_criteria": {}, "rejection_criteria": {}, "failed_criteria": [], "decision": "pass", "extension_required": false}, "extension_games": 0},
    {"seed": 22, "candidate_unit": 95, "checkpoint_sha256": "0000000000000000000000000000000000000000000000000000000000000000", "gate": {"format": "rl-s6-publication-evaluation-v2", "bootstrap": {}, "opponents": {}, "main": {}, "acceptance_criteria": {}, "rejection_criteria": {}, "failed_criteria": [], "decision": "pass", "extension_required": false}, "extension_games": 0},
    {"seed": 23, "candidate_unit": 105, "checkpoint_sha256": "0000000000000000000000000000000000000000000000000000000000000000", "gate": {"format": "rl-s6-publication-evaluation-v2", "bootstrap": {}, "opponents": {}, "main": {}, "acceptance_criteria": {}, "rejection_criteria": {}, "failed_criteria": [], "decision": "pass", "extension_required": false}, "extension_games": 0}
  ]
}
